{
  "canvas": {
    "width": 1920,
    "height": 1080,
    "fps": 30,
    "safeMargin": 84,
    "subtitleTop": 954,
    "subtitleFont": 40
  },
  "font": {
    "sans": "GameTheory Noto Sans SC",
    "serif": "GameTheory Noto Serif SC",
    "weights": [
      400,
      700
    ],
    "minMeaningfulLabel": 30,
    "body": 36
  },
  "semantic": {
    "actorA": {
      "shape": "circle",
      "position": "first"
    },
    "actorB": {
      "shape": "square",
      "position": "second"
    },
    "strategyRed": {
      "name": "红",
      "fill": "#BC3D31",
      "symbol": "disc"
    },
    "strategyBlue": {
      "name": "蓝",
      "fill": "#345D9E",
      "symbol": "bar"
    },
    "scoreOrder": [
      "A",
      "B"
    ]
  },
  "styles": {
    "editorial": {
      "name": "A · 纸上编辑",
      "subtitle": "宋体标题 × 黑白剪影 × 朱红批注",
      "paper": "#F7F4ED",
      "ink": "#20211F",
      "muted": "#575852",
      "line": "#B8B7AE",
      "accent": "#BD3D2E",
      "wash": "#F2DDD5",
      "stroke": 3,
      "titleFamily": "serif"
    },
    "textbook": {
      "name": "B · 清爽教材",
      "subtitle": "黑体层级 × 蓝线插图 × 标准矩阵",
      "paper": "#FFFEF8",
      "ink": "#243E66",
      "muted": "#51617A",
      "line": "#B9C5D4",
      "accent": "#355889",
      "wash": "#EAF0F6",
      "stroke": 3,
      "titleFamily": "sans"
    },
    "bright": {
      "name": "C · 明快图解",
      "subtitle": "粗线角色 × 明亮色块 × 动作式讲解",
      "paper": "#FFFEF8",
      "ink": "#252522",
      "muted": "#555550",
      "line": "#BEBEB3",
      "accent": "#E9BB33",
      "wash": "#FFF0A7",
      "purple": "#8A7ABB",
      "stroke": 5,
      "titleFamily": "sans"
    }
  },
  "schemaVersion": "1.0"
}
